{
  "id": "TR-0339",
  "fonte": "FO-0034",
  "grau_semelhanca": 1.0,
  "localizador": "p. 157 do PDF; car. 429380-429542 do texto normalizado (normalizacao-0.2)",
  "hash": "3f261b455fc127201eedd6a3d6e5c7ab35b49adbc0b78eb7850c4aa231a83a20",
  "versao_normalizacao": "normalizacao-0.2",
  "data_conferencia": "2026-10-29",
  "estado": "localizado",
  "texto_exato": "Desta forma, o complexo Amarante-Palmeirais (se comunicando por via fluvial e estrada secundária) parece ter sido um dos principais difusores da cajuína no Piauí.",
  "antes": "te a Amarante, ajudou a difundir a cajuína também em União. ",
  "depois": " Isso não elimina a possibilidade de terem aprendido a técni",
  "origem_texto": "fonte",
  "protecao": {
    "licenca": "não conferido",
    "consentimento": "não se aplica",
    "restricao_comunitaria": "nenhuma conhecida",
    "precisao_lugar": "não se aplica",
    "dado_sensivel": false,
    "crianca_ou_adolescente": false,
    "pedido_de_retirada": "nenhum"
  },
  "origem_registro": {
    "criado_por": "scripts/localizar_trecho.py (pelo avaliador)",
    "data": "2026-10-29",
    "execucao": "EX-0067",
    "versao_regra": "normalizacao-0.2"
  }
}
