{
  "id": "TR-0146",
  "fonte": "FO-0032",
  "grau_semelhanca": 1.0,
  "localizador": "p. 28 do PDF; car. 68351-68495 do texto normalizado (normalizacao-0.2)",
  "hash": "2f7ff74e45db8b15a2e4a6617ca5c17f8114481736e587d344bf09b8f7f58a02",
  "versao_normalizacao": "normalizacao-0.2",
  "data_conferencia": "2026-10-29",
  "estado": "localizado",
  "texto_exato": "a eliminação da flora microbiana presente no suco do caju, deixando finalmente o produto livre de microrganismos que acarretariam na fermentação",
  "antes": "iente para garantir a esterilização/pasteurização. O o, ren ",
  "depois": ". 6.1 Novos produtores de cajuína e o incentivo de atores in",
  "origem_texto": "fonte",
  "protecao": {
    "licenca": "não conferido",
    "consentimento": "não se aplica",
    "restricao_comunitaria": "nenhuma conhecida",
    "precisao_lugar": "não se aplica",
    "dado_sensivel": false,
    "crianca_ou_adolescente": false,
    "pedido_de_retirada": "nenhum"
  },
  "origem_registro": {
    "criado_por": "scripts/localizar_trecho.py (pelo avaliador)",
    "data": "2026-10-29",
    "execucao": "EX-0066",
    "versao_regra": "normalizacao-0.2"
  }
}
