{
  "id": "TR-0099",
  "fonte": "FO-0033",
  "grau_semelhanca": 1.0,
  "localizador": "p. 19 do PDF; car. 88271-88455 do texto normalizado (normalizacao-0.2)",
  "hash": "3bb310cb4a89f95e370f93176b436d70aba65ed2d908142ce4aa7fa443f9d350",
  "versao_normalizacao": "normalizacao-0.2",
  "data_conferencia": "2026-10-29",
  "estado": "localizado",
  "texto_exato": "foi o saber popular piauiense (de forma nenhuma restrito às elites) que (re)inventou os métodos de produção e as sociabilidades vinculadas ao consumo e apreciação dessa bebida/alimento",
  "antes": "do Piauí) como a ancestralidade daquela produção artesanal, ",
  "depois": ". Nas narrativas dos produtores praticamente não aparece uma",
  "origem_texto": "fonte",
  "protecao": {
    "licenca": "não conferido",
    "consentimento": "não se aplica",
    "restricao_comunitaria": "nenhuma conhecida",
    "precisao_lugar": "não se aplica",
    "dado_sensivel": false,
    "crianca_ou_adolescente": false,
    "pedido_de_retirada": "nenhum"
  },
  "origem_registro": {
    "criado_por": "scripts/localizar_trecho.py (pelo avaliador)",
    "data": "2026-10-29",
    "execucao": "EX-0065",
    "versao_regra": "normalizacao-0.2"
  }
}
