{
  "id": "TR-0194",
  "fonte": "FO-0033",
  "grau_semelhanca": 1.0,
  "localizador": "p. 12 do PDF; car. 57441-57555 do texto normalizado (normalizacao-0.2)",
  "hash": "3bb310cb4a89f95e370f93176b436d70aba65ed2d908142ce4aa7fa443f9d350",
  "versao_normalizacao": "normalizacao-0.2",
  "data_conferencia": "2026-10-29",
  "estado": "localizado",
  "texto_exato": "Após a patrimonialização da Cajuína observou-se um aumento do consumo. A Cajuína passou a ser ainda mais conhecida",
  "antes": "uir novos trajetos de comercialização incentivo ao consumo \"",
  "depois": " além disso, passou a ser procurada(...)' aﬁrmou o proprietá",
  "origem_texto": "fonte",
  "protecao": {
    "licenca": "não conferido",
    "consentimento": "não se aplica",
    "restricao_comunitaria": "nenhuma conhecida",
    "precisao_lugar": "não se aplica",
    "dado_sensivel": false,
    "crianca_ou_adolescente": false,
    "pedido_de_retirada": "nenhum"
  },
  "origem_registro": {
    "criado_por": "scripts/localizar_trecho.py (pelo avaliador)",
    "data": "2026-10-29",
    "execucao": "EX-0066",
    "versao_regra": "normalizacao-0.2"
  }
}
