{
  "id": "TR-0440",
  "fonte": "FO-0034",
  "grau_semelhanca": 1.0,
  "localizador": "p. 194 do PDF; car. 516988-517095 do texto normalizado (normalizacao-0.2)",
  "hash": "3f261b455fc127201eedd6a3d6e5c7ab35b49adbc0b78eb7850c4aa231a83a20",
  "versao_normalizacao": "normalizacao-0.2",
  "data_conferencia": "2026-10-29",
  "estado": "localizado",
  "texto_exato": "promova uma conversa amigável com o SEBRAE no intuito de convencê-lo a flexibilizar o plano de padronização",
  "antes": "(1) Por um lado, parece que ainda há tempo para que o IPHAN ",
  "depois": " que está em franco desenvolvimento. Conforme indicações da ",
  "origem_texto": "fonte",
  "protecao": {
    "licenca": "não conferido",
    "consentimento": "não se aplica",
    "restricao_comunitaria": "nenhuma conhecida",
    "precisao_lugar": "não se aplica",
    "dado_sensivel": false,
    "crianca_ou_adolescente": false,
    "pedido_de_retirada": "nenhum"
  },
  "origem_registro": {
    "criado_por": "scripts/localizar_trecho.py (pelo avaliador)",
    "data": "2026-10-29",
    "execucao": "EX-0068",
    "versao_regra": "normalizacao-0.2"
  }
}
