{
  "id": "TR-0375",
  "fonte": "FO-0034",
  "grau_semelhanca": 1.0,
  "localizador": "p. 169 do PDF; car. 458927-458994 do texto normalizado (normalizacao-0.2)",
  "hash": "3f261b455fc127201eedd6a3d6e5c7ab35b49adbc0b78eb7850c4aa231a83a20",
  "versao_normalizacao": "normalizacao-0.2",
  "data_conferencia": "2026-10-29",
  "estado": "localizado",
  "texto_exato": "Essas latas foram substituídas por tonéis de ferro cortados ao meio",
  "antes": "s de querosene que eram usadas inicialmente para a fervura. ",
  "depois": ". As senhoras foram descobrindo o ponto certo de se encher a",
  "origem_texto": "fonte",
  "protecao": {
    "licenca": "não conferido",
    "consentimento": "não se aplica",
    "restricao_comunitaria": "nenhuma conhecida",
    "precisao_lugar": "não se aplica",
    "dado_sensivel": false,
    "crianca_ou_adolescente": false,
    "pedido_de_retirada": "nenhum"
  },
  "origem_registro": {
    "criado_por": "scripts/localizar_trecho.py (pelo avaliador)",
    "data": "2026-10-29",
    "execucao": "EX-0068",
    "versao_regra": "normalizacao-0.2"
  }
}
