{
  "id": "TR-0101",
  "fonte": "FO-0033",
  "grau_semelhanca": 0.9746,
  "localizador": "p. 21 do PDF; car. 98952-99069 do texto normalizado (normalizacao-0.2)",
  "hash": "3bb310cb4a89f95e370f93176b436d70aba65ed2d908142ce4aa7fa443f9d350",
  "versao_normalizacao": "normalizacao-0.2",
  "data_conferencia": "2026-10-29",
  "estado": "localizado",
  "texto_exato": "como é que um pequeno produtor sem ﬁnanciamento, sem ajuda ﬁnanceira do governo vai ter dinheiro para fazer esse mapa",
  "antes": " chique, você tem que ter um mapa. E esse mapa é caríssimo, ",
  "depois": ". Esse mapa é um registro do Ministério da Agricultura, eu a",
  "origem_texto": "fonte",
  "protecao": {
    "licenca": "não conferido",
    "consentimento": "não se aplica",
    "restricao_comunitaria": "nenhuma conhecida",
    "precisao_lugar": "não se aplica",
    "dado_sensivel": false,
    "crianca_ou_adolescente": false,
    "pedido_de_retirada": "nenhum"
  },
  "origem_registro": {
    "criado_por": "scripts/localizar_trecho.py (pelo avaliador)",
    "data": "2026-10-29",
    "execucao": "EX-0065",
    "versao_regra": "normalizacao-0.2"
  }
}
