{
  "id": "TR-0386",
  "fonte": "FO-0034",
  "grau_semelhanca": 1.0,
  "localizador": "p. 171 do PDF; car. 462562-462691 do texto normalizado (normalizacao-0.2)",
  "hash": "3f261b455fc127201eedd6a3d6e5c7ab35b49adbc0b78eb7850c4aa231a83a20",
  "versao_normalizacao": "normalizacao-0.2",
  "data_conferencia": "2026-10-29",
  "estado": "localizado",
  "texto_exato": "que consiste na adição de alguma substância que provoque a precipitação do tanino do suco do caju, clarificando, assim, esse suco",
  "antes": "e ao termo \"coalhar\", como se faz com o leite, no Sudeste), ",
  "depois": ". Originalmente, essa substância era a própria resina da árv",
  "origem_texto": "fonte",
  "protecao": {
    "licenca": "não conferido",
    "consentimento": "não se aplica",
    "restricao_comunitaria": "nenhuma conhecida",
    "precisao_lugar": "não se aplica",
    "dado_sensivel": false,
    "crianca_ou_adolescente": false,
    "pedido_de_retirada": "nenhum"
  },
  "origem_registro": {
    "criado_por": "scripts/localizar_trecho.py (pelo avaliador)",
    "data": "2026-10-29",
    "execucao": "EX-0068",
    "versao_regra": "normalizacao-0.2"
  }
}
