{
  "id": "TR-0504",
  "fonte": "FO-0034",
  "grau_semelhanca": 1.0,
  "localizador": "p. 100 do PDF; car. 276794-276882 do texto normalizado (normalizacao-0.2)",
  "hash": "3f261b455fc127201eedd6a3d6e5c7ab35b49adbc0b78eb7850c4aa231a83a20",
  "versao_normalizacao": "normalizacao-0.2",
  "data_conferencia": "2026-10-29",
  "estado": "localizado",
  "texto_exato": "os Tremembés que habitavam o Delta do Paranaíba, região possivelmente originária do caju",
  "antes": "foi travada, pela expedição de Vital Maciel Parente, contra ",
  "depois": ", e [detalhe na pasta local, D-043 (3); F-0033]",
  "origem_texto": "fonte",
  "protecao": {
    "licenca": "não conferido",
    "consentimento": "não se aplica",
    "restricao_comunitaria": "o 'depois' guardado na pasta local (D-043, 3; F-0033)",
    "precisao_lugar": "não se aplica",
    "dado_sensivel": false,
    "crianca_ou_adolescente": false,
    "pedido_de_retirada": "nenhum"
  },
  "origem_registro": {
    "criado_por": "scripts/localizar_trecho.py (pelo avaliador)",
    "data": "2026-10-29",
    "execucao": "EX-0069",
    "versao_regra": "normalizacao-0.2"
  }
}
