{
  "id": "TR-0501",
  "fonte": "FO-0034",
  "grau_semelhanca": 1.0,
  "localizador": "p. 90 do PDF; car. 249584-249745 do texto normalizado (normalizacao-0.2)",
  "hash": "3f261b455fc127201eedd6a3d6e5c7ab35b49adbc0b78eb7850c4aa231a83a20",
  "versao_normalizacao": "normalizacao-0.2",
  "data_conferencia": "2026-10-29",
  "estado": "localizado",
  "texto_exato": "a bebida vira presentes para os filhos da terra que retornam ao lar ou que partem para estudar em cidades distantes ou para ocupar seus postos no serviço público",
  "antes": "eservação, mas que também alteravam estados de consciência, ",
  "depois": " ou em profissões liberais em outros Estados. Emblemas da ca",
  "origem_texto": "fonte",
  "protecao": {
    "licenca": "não conferido",
    "consentimento": "não se aplica",
    "restricao_comunitaria": "nenhuma conhecida",
    "precisao_lugar": "não se aplica",
    "dado_sensivel": false,
    "crianca_ou_adolescente": false,
    "pedido_de_retirada": "nenhum"
  },
  "origem_registro": {
    "criado_por": "scripts/localizar_trecho.py (pelo avaliador)",
    "data": "2026-10-29",
    "execucao": "EX-0069",
    "versao_regra": "normalizacao-0.2"
  }
}
