{
  "id": "TR-0464",
  "fonte": "FO-0034",
  "grau_semelhanca": 1.0,
  "localizador": "p. 78 do PDF; car. 215382-215531 do texto normalizado (normalizacao-0.2)",
  "hash": "3f261b455fc127201eedd6a3d6e5c7ab35b49adbc0b78eb7850c4aa231a83a20",
  "versao_normalizacao": "normalizacao-0.2",
  "data_conferencia": "2026-10-29",
  "estado": "localizado",
  "texto_exato": "o Governo do Estado do Piauí declarou a cajuína sua bebida oficial a ser servida em reuniões de governo, solenidades oficiais no Palácio, celebrações",
  "antes": "dade de Teresina e todo o Estado ao músico!). Recentemente, ",
  "depois": ". Com isso, o Governo adere duas marcas identitárias à sua i",
  "origem_texto": "fonte",
  "protecao": {
    "licenca": "não conferido",
    "consentimento": "não se aplica",
    "restricao_comunitaria": "nenhuma conhecida",
    "precisao_lugar": "não se aplica",
    "dado_sensivel": false,
    "crianca_ou_adolescente": false,
    "pedido_de_retirada": "nenhum"
  },
  "origem_registro": {
    "criado_por": "scripts/localizar_trecho.py (pelo avaliador)",
    "data": "2026-10-29",
    "execucao": "EX-0068",
    "versao_regra": "normalizacao-0.2"
  }
}
