{
  "id": "TR-0382",
  "fonte": "FO-0034",
  "grau_semelhanca": 1.0,
  "localizador": "p. 171 do PDF; car. 462242-462380 do texto normalizado (normalizacao-0.2)",
  "hash": "3f261b455fc127201eedd6a3d6e5c7ab35b49adbc0b78eb7850c4aa231a83a20",
  "versao_normalizacao": "normalizacao-0.2",
  "data_conferencia": "2026-10-29",
  "estado": "localizado",
  "texto_exato": "toda sorte de garrafas reaproveitadas, com marcas de refrigerantes diversos ou (as favoritas) garrafinhas descartáveis de cerveja Longneck",
  "antes": "mportadas de Recife. Usina Santanna, Teresina. 171 corram a ",
  "depois": ". f) O Corte: A etapa mais crucial e mágica do processo de f",
  "origem_texto": "fonte",
  "protecao": {
    "licenca": "não conferido",
    "consentimento": "não se aplica",
    "restricao_comunitaria": "nenhuma conhecida",
    "precisao_lugar": "não se aplica",
    "dado_sensivel": false,
    "crianca_ou_adolescente": false,
    "pedido_de_retirada": "nenhum"
  },
  "origem_registro": {
    "criado_por": "scripts/localizar_trecho.py (pelo avaliador)",
    "data": "2026-10-29",
    "execucao": "EX-0068",
    "versao_regra": "normalizacao-0.2"
  }
}
