{
  "id": "TR-0444",
  "fonte": "FO-0034",
  "grau_semelhanca": 1.0,
  "localizador": "p. 55 do PDF; car. 148785-148876 do texto normalizado (normalizacao-0.2)",
  "hash": "3f261b455fc127201eedd6a3d6e5c7ab35b49adbc0b78eb7850c4aa231a83a20",
  "versao_normalizacao": "normalizacao-0.2",
  "data_conferencia": "2026-10-29",
  "estado": "localizado",
  "texto_exato": "A cajuína se insere como um elemento dos rituais de hospitalidade que analisaremos a seguir",
  "antes": "os, e o estabelecimento de rituais de etiqueta e distinção. ",
  "depois": ", reunindo características desejáveis e novas, como a limpez",
  "origem_texto": "fonte",
  "protecao": {
    "licenca": "não conferido",
    "consentimento": "não se aplica",
    "restricao_comunitaria": "nenhuma conhecida",
    "precisao_lugar": "não se aplica",
    "dado_sensivel": false,
    "crianca_ou_adolescente": false,
    "pedido_de_retirada": "nenhum"
  },
  "origem_registro": {
    "criado_por": "scripts/localizar_trecho.py (pelo avaliador)",
    "data": "2026-10-29",
    "execucao": "EX-0068",
    "versao_regra": "normalizacao-0.2"
  }
}
